{
  "artifactPolicy": "compact-validator-attestation-v1",
  "codexVersion": "codex-cli 0.153.4",
  "corpus": {
    "largestSkillBytes": 9659,
    "references": 47,
    "skillDescriptionCharacters": 43991,
    "skillMainLines": 6134,
    "skills": 156,
    "versionResolvers": 24
  },
  "gateEvidence": [
    {
      "command": [
        "bash",
        "scripts/framework-health.sh"
      ],
      "exitCode": 0,
      "name": "deterministicHealth",
      "output": "ok 01 native AGENTS instruction file exists\nok 02 visible native planning and delegation contract exists\nfresh-context review check passed: neutral bundle and semantic reversals\nok 03 bounded falsification-review contract exists\nok 04 interactive Browser and mobile device lifecycle is automatic and task-owned\nnative task topology check passed: authoritative rules and semantic reversals\nok 05 current native task and automation features have explicit adoption boundaries\nok 06 project and environment authority fails closed before substitute infrastructure\nok 07 project and environment authority rejects contradictory fallback authorization\nok 08 project and environment authority rejects required-field omissions\nok 09 behavioral fallbacks fail closed by default\nok 10 behavioral fallback policy rejects hidden-success counterexamples\nok 11 behavioral fallback policy rejects required-field omissions\nok 12 capability discovery uses an existing local CLI before a plugin gate\nok 13 capability discovery rejects premature plugin-install counterexamples\nok 14 capability discovery rejects required-field omissions\nnative capability review passed (static): rust-v0.153.4 through 2026-09-08\nnative capability ledger self-test: passed\nok 15 framework maintenance automatically checks current native capability deltas\nok 16 generic policy is single-owned without duplicate startup payloads\ntoken budget self-test passed\n{\n  \"static\": \"passed\"\n}\ntoken budget check passed\nok 17 token budgets preserve native optimization defaults\nok 18 global guidance template exists\nok 19 global guidance prefers native capabilities\nok 20 native config parses strictly\nok 21 strict native config rejects an unknown agent key\nok 22 project config is present and not ignored from source control\nok 23 agent architect profile is valid\nok 24 agent reviewer profile is valid\nok 25 reviewer remains read-only and non-recursive\nok 26 agent tester profile is valid\nok 27 built-in explorer is not shadowed\nok 28 built-in worker is not duplicated\nok 29 current agent concurrency key is used\nok 30 native Codex owns agent delegation depth\nok 31 reasoning overrides are limited to judgment-heavy profiles\nok 32 hook config has no context-injection or lifecycle routing\nok 33 custom profiles inherit the native model catalog\nok 34 project hook paths are portable\nok 35 repo plugin marketplace is valid JSON\nok 36 frontend design plugin manifest is valid JSON\nok 37 legacy duplicate hooks plugin is absent\nok 38 native destructive-command rules exist\nok 39 obsolete runtime wrappers are absent\nok 40 native workflow wrapper skills are absent\nok 41 universal core remains at most 25 skills\nskill governance: 0 failures, 0 warnings, 156 skills, 1 core\nok 42 skill governance passes\nversion source registry: 24 dynamic resolvers, structural checks passed\nok 43 dynamic version resolvers and numeric scaffold guard pass\nstack context self-test: passed\nok 44 version drift counterexamples are rejected\nskill quality: 156/156 contracts structurally validated; 0 scaffolds are not certifiable\nskill quality: 0 failures\nok 45 every skill has a strict quality and routing contract\nskill quality self-test: passed\nok 46 quality evaluator rejects its counterexamples\nrelease evidence self-test: passed\nok 47 release evidence rejects fabricated attestations\nok 48 release interruption owns and terminates evaluator children\nok 49 setup preserves colliding user skill and all existing guidance targets\nok 50 managed agent copies update safely and migrate legacy symlinks\nok 51 project pack sync is declarative, idempotent, pruning, and collision-safe\nok 52 hook installer rejects unrelated lifecycle config without writes\nok 53 bootstrap accepts an existing safety hook without native-default optimization pins\nhook smoke passed\nok 54 hook smoke passes\nok 55 curl pipe guard blocks shell piping\nok 56 task-owned absolute temporary cleanup is not overblocked\nok 57 implementation-revealing branch names are blocked\nok 58 human intent branch names are allowed\nok 59 nested root deletion is blocked\nok 60 unset-variable root fallback deletion is blocked\nok 61 home-default deletion is blocked\nok 62 root glob deletion is blocked\nok 63 relative recursive removal is blocked without ownership proof\nframework eval: 63 checks, 0 failures\nnative capability review passed (static): rust-v0.153.4 through 2026-09-08\nfresh-context review check passed: neutral bundle and semantic reversals\nnative task topology check passed: authoritative rules and semantic reversals\nnative capability review passed (static): rust-v0.153.4 through 2026-09-08\nnative capability ledger self-test: passed\nhook smoke passed\nframework drift check passed\nok project config parses in native Codex\nok strict config validation rejects unknown keys\nok project config is eligible for source control, not ignored local state\nok shared native agent concurrency is bounded\nok tool output retention is bounded\nok native-default optimization pins are absent\nok native Codex owns agent delegation depth\nok no surface-specific runtime branch exists\nok no startup prompt payload is injected\nok custom profiles inherit the current catalog model\nok routine tester inherits native reasoning selection\nok project config is machine portable\nsurface parity: 0 failures\nframework health: 0 failures\n",
      "outputSha256": "d9a9ff3cc8530838c5e088cefa7c1f1f4bceff83448f9080749b473c2974b27f"
    },
    {
      "command": [
        "python3",
        "scripts/framework-token-budget-check.py",
        "--live"
      ],
      "exitCode": 0,
      "name": "tokenEfficiency",
      "output": "{\n  \"livePrompt\": {\n    \"frameworkInstructionBytes\": 13731,\n    \"frameworkSkillVisible\": true,\n    \"items\": 5,\n    \"sentinelVisible\": true,\n    \"textParts\": 10,\n    \"totalChars\": 36152\n  },\n  \"static\": \"passed\"\n}\ntoken budget check passed\n",
      "outputSha256": "c6bb4c88c0d441cad77b0ff484f758ddcef5af87fde8ed1da1d09b9c87fd9717"
    },
    {
      "command": [
        "bash",
        "scripts/framework-doctor.sh",
        "--skip-evidence"
      ],
      "exitCode": 0,
      "name": "effectiveInstallDoctor",
      "output": "ok framework doctor: legacy framework skill namespaces are absent\nok framework doctor: profile copies and safety rule match this framework checkout\nok framework doctor: auxiliary framework links match explicit ownership state\nok framework doctor: global guidance is managed by this framework checkout\nok framework doctor: canonical USER skills and intentionally global packs match install state\nok framework doctor: project-scoped packs match their declarative manifest\nok framework doctor: project hooks are installed and source-owned\nnote framework doctor: effective install checks above describe the linked development checkout; they do not certify a release\nok framework doctor: framework-owned token budgets are enforced without overriding native optimization defaults\nok framework doctor: native prompt metadata contains one core skill and no retired framework skills\nnote framework doctor: ignored TERM=dumb because this audit is running without a TTY\nok framework doctor: native codex doctor has no actionable failures\nframework doctor: 0 failures\n",
      "outputSha256": "1a7408e5f52470780e641770a27b1a393063e7d405e5063ddb166e474601a940"
    },
    {
      "command": [
        "bash",
        "scripts/framework-skill-loader-live-eval.sh"
      ],
      "exitCode": 0,
      "name": "nativeSkillLoaderCanary",
      "output": "native skill loader canary passed: discovery, EOF, required reference, observable read trace excludes forbidden reference\n",
      "outputSha256": "1a9ffb729545741465d857a708b8327509d74440b6efc9fa20935bb67cbb332f"
    },
    {
      "command": [
        "bash",
        "scripts/framework-version-drift-check.sh",
        "--live"
      ],
      "exitCode": 0,
      "name": "liveVersionResolution",